{
  "schema_version": "1.0.0",
  "oracle_id": "sha256:5b48d15538e89b32b7c14051cd3ba3a69044e15f6034052788f2e42c017b8b9e",
  "repository_id": "repo:example/codex-governed-change",
  "task_contract_sha256": "sha256:bbbbbbbbbbbbbbbbbbbbbbbbbbbbbbbbbbbbbbbbbbbbbbbbbbbbbbbbbbbbbbbb",
  "candidate_id": "sha256:cccccccccccccccccccccccccccccccccccccccccccccccccccccccccccccccc",
  "name": "Protected authority consistency",
  "source": "docs/requirements.md",
  "source_sha256": "sha256:dddddddddddddddddddddddddddddddddddddddddddddddddddddddddddddddd",
  "heuristic": "Compare effective admission inputs with the previous protected LKG policy.",
  "known_fallibility": ["The protected policy can omit a novel authority surface."],
  "applicability": "Governance, workflow, schema, reviewer and admission changes.",
  "created_at": "2026-08-26T10:00:00Z"
}
